keys,es,en,pt_BR,zh_CN
AURA_DESC,"Aura Eclair, es la hija de Gabriel, quien trabaja en una tienda en Amerithia.

Ha pedido ayuda con encontrar a sus tres gatos que están perdidos en Grijayla. A cambio, dará como recompensa un objeto con forma de caja que encontró mientras jugaba, la caja lleva inscrito la palabra ""Daguerrotipo"".","Aura Eclair is Gabriel's daughter who works in a store in Amerithia.

She has asked for help with finding her three cats that are lost in Grijayla. In return, she will give a box-shaped object she found while playing as a reward. The box is inscribed with the word ""Daguerreotype"".","Aura Eclair é filha do Gabriel, que trabalha numa loja em Amerithia.

Ela pediu ajuda para encontrar seus três gatos perdidos em Grijayla. Em troca, ela te dará como recompensa um objeto em formato de caixa que ela encontrou enquanto brincava, a caixa está gravada com a palavra ""Daguerreótipo"".","奥拉·埃克莱尔是加布里埃尔的女儿，也在阿美瑞西亚的一家商店里工作。

她委托人帮忙寻找自己在格里哈伊拉走失的三只猫。作为报酬，她愿意把自己玩耍时捡到的一个盒状物交出来。那个盒子上刻着“银版摄影机”一词。"
TAHUATEPETL_TITLE,Isletas de Tahuatepetl,Tahuatepetl Islets,Ilhotas Tahuatepetl,塔瓦特佩特群岛
TAHUATEPETL_DESC,"Recibe el nombre de ""Isletas de Tahuatepetl"" a una serie de más de trescientos islotes ubicadas en el mar de Niquira.

Se cree que el origen de estas isletas se debe a un derrumbe del volcán que se encuentra en la ""isla mayor"" hace mil años.

Las isletas han sido pobladas por una tribu de personas especializadas en la pesca hace medio siglo. Sin embargo la isleta de mayor tamaño permanece deshabitada debido a la actividad volcánica del Koapolkán.","The ""Tahuatepetl islets"" is a series of over three hundred islets located in the Sea of Niquira.

It is believed that these islets originated from a volcanic collapse on the ""main island"" a thousand years ago.

The islets have been inhabited by a tribe of people specializing in fishing for half a century. However, the largest islet remains uninhabited due to the volcanic activity of the Koapolkán.","É chamada ""Ilhotas Tahuatepetl"" uma série de mais de trezentas ilhotas localizadas no Mar de Niquira.

Acredita-se que tais ilhotas foram originadas de uma uma caldeira vulcânica na “ilha principal” há mil anos atrás.

Essas ilhotas foram habitadas por uma tribo especializada na pesca por meio século. Porém, a maior ilhota mantém inabitada.","“塔瓦特佩特群岛”是一片由三百多座小岛组成的群岛，位于尼基拉海。

人们相信，这些岛屿形成于千年前“主岛”火山塌陷之后。

半个世纪以来，这些岛上一直居住着一个以捕鱼为生的部族。不过，由于科阿波尔坎的火山活动，最大的那座岛至今仍无人居住。"
DLETTER_TITLE,"Carta de ""D"".","""D"" Letter.",Carta “D”,“D”的信
DLETTER_DESC,"Espero que tu viaje a Grijayla haya transcurrido sin problemas, Gabriel.

Has servido fielmente a nuestro señor durante dos décadas. Lamento tener que encargarte de esta gran responsabilidad con la señorita.

Sé que te parece una locura mudarte a una ciudad tan cercana a la sede de La Orden en Amerithia, pero te aseguro que es el último lugar donde te buscarían.

Las distintas sedes de La Orden trabajan de manera independiente y rara vez comparten información entre ellas.

Estoy finalizando los últimos preparativos del viaje. Por favor, resiste un poco más.

Atentamente, ""D"".","I hope your trip to Grijayla went smoothly, Gabriel.

You have served our Lord faithfully for two decades. I am sorry to have you to take on this great responsibility with the young lady.

I know it seems crazy for you to move to a city so close to the headquarters of The Order in Amerithia, but I assure you it is the last place they would look for you.

The various headquarters of The Order work independently and rarely share information with each other.

I am finalizing the last preparations for the trip. Please, hold on a little longer.

Sincerely, “D”.","Eu espero que sua viagem a Grijayla não houve contratempos, Gabriel.

Você serviu fielmente o nosso lorde por duas décadas. Sinto muito de ter essa grande responsabilidade com a senhorita.

Eu sei que parece loucura para você se mudar para uma cidade tão próxima da sede da Ordem em Amerithia, mas eu te asseguro que é o último lugar que eles irão te procurar.

As várias sedes da Ordem trabalham independentemente e raramente compartilha informações entre elas.

Estou finalizando as últimas preparações para a viagem. Por favor, espere um pouco mais.

Sinceramente, “D”.","希望你前往格里哈伊拉的旅途一切顺利，加布里埃尔。

这二十年来，你一直忠心侍奉我们的主。让你带着那位年轻小姐承担如此重大的责任，我深感抱歉。

我知道，要你搬到离阿美瑞西亚教团总部如此之近的城市，看起来近乎疯狂；但我向你保证，那恰恰会是他们最不会去找你的地方。

教团的各处分部彼此独立运作，极少互通情报。

我正在做出发前最后的准备。请再坚持一阵子。

此致，
“D”"
BAKDASHONATK,Esquivar al atacar,Backdash on attack,Recuo no ataque,攻击中的后闪
NEGATIVESTATUS,Estados negativos,Negative status,Condição negativa,负面状态
THERMALRESIS,Resistencia térmica,Thermal resistance,Resistência termal,环境耐性
ABOUTDAMAGEINFLICT,Acerca del daño inflingido,About the damage inflicted,Sobre o dano infligido,关于造成的伤害
RESISTANDWEAKNS,Resistencias y debilidades,Resistances and weaknesses,Resistências e fraquezas,抗性与弱点
ABOUTMULTIPLEEQUIP,Acerca del equipamiento múltiple,About Multiple equipment,Sobre o Equipamento Múltiplo,关于多套装备
BAKDASHONATK_DESC,"Cuanto atacas no puedes moverte, si usas el botón para esquivar puedes evitar ser dañado por el enemigo, parece tonto decirlo pero hay personas que olvidan usarlo...","When you attack, you can't move. If you use the dodge button, you can avoid being damaged by the enemy. It seems silly to say it but there are people who forget to use it...","Quando você ataca você não consegue se mover, se usar o botão de esquiva você pode evitar de ser atacado pelo inimigo. Parece tolice, mas tem pessoas que se esquecem de usar…",攻击时你无法移动。如果在攻击过程中使用闪避按钮，就能避开敌人的伤害。听起来像是废话，但确实有人会忘记这么做……
NEGATIVESTATUS_DESC,"Existen tres estados negativos que algunos enemigos pueden infligirte.

Envenenado: Pierdes un poco de salud gradualmente.
Lesionado: Tus estadísticas se reducen a la mitad.
Maldito: Pierdes maná continuamente.

Para cada uno de estos estados existe un objeto que puede curarte, consumibles disponibles en la tienda.","There are three negative states that some enemies can inflict on you.

Poisoned: You gradually lose some health.
Injured: Your stats are reduced by half.
Cursed: You lose mana continuously.

For each of these states, there is an item that can heal you. Consumables are available in the store.","Há três condições negativas que alguns inimigos podem infligir em você:

Envenenada: Gradualmente perderá saúde.
Ferida: Suas habilidades são reduzidas pela metade.
Amaldiçoada: Você perde mana continuamente.

Para cada um, há um item que te cura, consumíveis disponíveis na loja.","有三种负面状态可能由部分敌人施加给你。

中毒：生命会逐渐减少。
受伤：你的各项属性减半。
诅咒：法力会持续流失。

这三种状态各自都有对应的治疗道具，消耗品可在商店购买。"
THERMALRESIS_DESC,"Existen lugares con climas extremos, el cuerpo humano no podrá permanecer mucho tiempo en estos ambientes, al llegar a un límite perderás salud gradualmente, existen consumibles u objetos en el entorno que podrá aliviar la temperatura corporal.","There are places with extreme climates. The human body will not be able to stay in these environments for too long. When you reach your limit, you will gradually lose health. There are consumables or objects in the environment that can alleviate body temperature.","Há locais com climas extremos, o corpo humano não será capaz de ficar por muito tempo nesses ambientes, quando você alcança um limite você gradualmente perderá saúde, há consumíveis ou objetos no ambiente que podem aliviar a temperatura corporal.",有些地方气候极端，人体无法在这种环境中停留太久。一旦超过极限，你的生命就会逐渐流失。你可以通过消耗品，或利用环境中的某些物体，来缓解体温负担。
ABOUTDAMAGEINFLICT_DESC,"Al dañar a un enemigo verás un número aparecer que representa el daño inflingido, puede ser de utilidad ver ese número para determinar si el plan actual es efectivo contra el enemigo.","When damaging an enemy, you will see a number appear that represents the damage inflicted. It may be useful to see that number to determine if the current plan is effective against the enemy.","Quando atacar um inimigo, você verá um número aparecendo que representando o dano infligido, pode ser útil ver o número para determinar se o atual plano é efetivo.",对敌人造成伤害时，画面上会出现一个数字，用来表示你造成的伤害量。观察这个数字，有助于判断当前战术对该敌人是否有效。
RESISTANDWEAKNS_DESC,"Los enemigos pueden ser resistentes, invulnerables o invencibles ante ciertas [propiedades elementales]. Cada aleación de tu arma o circuito elemental puede tener una propiedad elemental.

Las propiedades son: Aqua, Pyro, Frigo, Aeria, Electro, Lux y Tenebris.

Algunos enemigos incluso pueden absorber el daño de una propiedad específica...","Enemies can be resistant, invulnerable or invincible to certain [elemental properties]. Each alloy of your weapon or elemental circuit can have an elemental property.

The properties are: Aqua, Pyro, Frigo, Aeria, Electro, Lux and Tenebris.

Some enemies can even absorb damage from a specific property...","Inimigos podem ser resistentes, invulneráveis ou invencíveis a certas [propriedades elementais]. Cada liga de sua arma ou circuito elemental pode ter uma propriedade elemental.

As propriedades são: Aqua, Pyro, Frigo, Aeria, Electro, Lux and Tenebris.

Alguns inimigos podem até absorver o dano de uma propriedade específica…","敌人可能会对某些 [元素属性] 具有抗性、无敌性，甚至完全免疫。你的武器合金与元素回路都可能附带某种元素属性。

这些属性分别是：水、炎、冰、风、雷、光、暗。

有些敌人甚至还能吸收某一种属性所造成的伤害……"
ABOUTMULTIPLEEQUIP_DESC,"Existe un Circuito elemental que te permitirá cambiar sets de Aleación+Circuito, con esta habilidad podrás cambiar en tiempo real entre tres diferentes conjuntos de aleaciones y circuitos equipados, de esta manera podrás usar el arma adecuada con el enemigo adecuado.","There is an Elemental Circuit that will allow you to switch Alloy+Circuit sets. With this ability, you can switch in real time between three different sets of alloys and equipped circuits. This way, you can use the right weapon with the right enemy.","Tem um Circuito Elemental que te permite trocar os conjuntos Liga+Circuito, com essa habilidade você pode trocar em tempo real entre trê diferentes conjuntos de ligas e circuitos equipados, desta forma você pode usar a arma certa no inimigo certo.",有一种元素回路能让你切换“合金+回路”套装。掌握这项能力后，你就能实时在三套不同的合金与装备回路之间切换。这样一来，你就能对不同敌人使用最合适的武器。
SHEAL_TITLE,,Sheal Avicena,Sheal Avicena,希尔·阿维森纳
SHEAL_DESC,"Sheal Avicena, alquimista de Nitrogeno. Un Adeptis que al ver sus planes frustrados, no hace más que escapar. Se ha refugiado en lo alto de una montaña ubicado en Eztilia.","Sheal Avicenna, alchemist of Nitrogen. An Adeptis who, seeing his plans thwarted, does nothing but escape. He has taken refuge on the top of a mountain located in Eztilia.","Sheal Avicenna, alquimista de Nitrogênio. Um Adeptis que, ao ver seus planos ir por água abaixo, faz nada além de fugir. Ele buscou refúgio no topo de uma montanha localizada em Eztilia.",希尔·阿维森纳，氮之炼金术师。一名在计划受挫后只知不断逃亡的 Adeptis。如今他躲藏在埃兹提利亚一座山峰的顶端。
FIVEBIRDS_TITLE,Dioses alados,Winged Gods,Deuses Alados,有翼诸神
FIVEBIRDS_DESC,"En un acto de sacrificio los cinco dioses reencarnaron en aves, para vigilar y proteger a sus pueblos desde los cielos...

Anidando allí, donde el ahuacatl crece, sus plumas brillan como esmeraldas, ocultas en lo alto de un bosque neblinoso, el canto de [Ixchel] resuena durante las primeras luces del alba.

[Ek Chuah] y [Chaac] mueven en péndulo largas plumas turquesas cerca de Koapolkán. A [Chaac] le gusta estar cerca de ríos y la comida hecha de maíz. Por el otro lado [Ek Chuah] no sale de su escondite, a menos que una mariposa esté cerca cuando cae la [noche].

Sigue el camino del viento después de una gran lluvia y ahí aparecerá [Hurakán]. Mientras que [Itzamná] prefiere cuidar de sus hijos en zonas ocultas y húmedas. ","In an act of sacrifice, the five gods reincarnated as birds to watch over and protect their people from the skies....

Nesting there, where the ahuacatl grows, their feathers shining like emeralds, hidden high in a misty forest, the song of [Ixchel] resounds during the first light of dawn.

[Ek Chuah] and [Chaac] swing long turquoise feathers like a pendulum near Koapolkán. [Chaac] likes to be near rivers and food made of corn. On the other side, [Ek Chuah] doesn't come out of his hiding place unless a butterfly is nearby when [night] falls.

You must follow the path of the wind after a heavy rain, and there [Hurakán] will appear. While [Itzamná] prefers to take care of her children in hidden, humid areas.","Num ato de sacrifício, os cinco deuses reincarnaram como pássaros para observar e proteger seu povo dos céus.…

Ao criar o ninho, onde ahuacatl cresce, suas penas brilham como esmeraldas nas profundezas de uma floresta anevoada, a canção de [Ixchel] resoa durante a primeira luz do amanhecer.

[Ek Chuah] e [Chaac] se movimentam em pêndulo as longas penas cor de turquesa próximas ao vulcão Koapolkán. [Chaac] gosta de estar próximo de rios e alimentos feitos de milho. Por outro lado, [Ek Chuah] não sai do seu esconderijo, a menos que haja uma borboleta por perto quando a [noite] cai.

Você deve seguir o caminho do vento após uma chuva forte e [Hurakán] aparecerá. Enquanto [Itzamná] prefere cuidar de suas crias em áreas escondidas e úmidas.","出于牺牲之举，五位神祇转生为鸟，自天空中守望并庇护他们的子民……

它们在牛油果树生长之地筑巢，羽毛如翡翠般闪耀，隐没于迷雾森林的高处；黎明的第一道微光中，便会响起 [伊什切尔] 的歌声。

[埃克·丘阿] 与 [查克] 会在科阿波尔坎附近摆动长长的绿松石色尾羽，宛如钟摆。[查克] 喜欢靠近河流，也偏爱玉米制成的食物。另一边，[埃克·丘阿] 除非在 [夜晚] 降临时有蝴蝶靠近，否则绝不会离开自己的藏身处。

而在一场大雨之后，你必须追随风的轨迹，届时 [胡拉坎] 才会现身。至于 [伊察姆纳]，她更喜欢在潮湿而隐蔽的地方照看自己的孩子。"
NEUMANDIARY_TITLE,Diario de Jean Neumann,Jean Neumann's Diary,Diário de Jean Neumann,让·诺伊曼的日记
NEUMANDIARY_DESC,"En el diario del Doctor Neumann se encuentra una explicación sobre las diferentes etapas para la creación del Opus Magnum.

En resumen Johannes planea utilizar un dispositivo de destrucción masiva, conocido como Núcleo del demonio.

También debe contar con el alquimista controlador de sangre para utilizar las vidas sacrificadas finalizando con un poder que permite a un alquimista controlar otro elemento.

Hay más información que está siendo analizada por la directora Alessa y Margaret.","In Dr. Neumann's diary, there is an explanation of the different stages for the creation of the Opus Magnum.

In short, Johannes plans to use a device of mass destruction known as the Demon Core.

He must also rely on the blood controlling alchemist to use the sacrificed lives ending with a power that allows an alchemist to control another element.

There is more information being analyzed by Director Alessa and Margaret.","No diário de Dr. Neumann há uma explicação dos diferentes estágios da criação da Opus Magnum.

Em resumo, Johannes planeja usar um dispositivo de destruição em massa, conhecido como o Núcleo Demoníaco.

Ele também deve contar com um alquimista controlador de sangue para usar as vidas sacrificadas, finalizando com um poder que permita um alquimista controlar outro elemento.

Há mais informação sendo analisada pela Diretora Alessa e Margaret.","在诺伊曼博士的日记中，记载了创造至高杰作各个阶段的说明。

简而言之，约翰内斯打算使用一种被称作“恶魔核心”的大规模毁灭装置。

他还必须借助那位能够操控鲜血的炼金术师，利用被献祭者的生命，最终获得一种能让炼金术师操控另一种元素的力量。

更多情报目前仍由娅蕾莎主任与玛格丽特负责分析。"
ELISIAADEPTIS_TITLE,Elisia Boyle,Elisia Boyle,Elisia Boyle,艾莉西亚·博伊尔
ELISIAADEPTIS_DESC,Elisia Boyle es una de los Adeptis. En el pasado ella era también huerfana y vivía en el mismo orfanato que Xandria.,"Elisia Boyle is one of the Adeptis. In the past, she was also an orphan and lived in the same orphanage as Xandria.","Elisia Boyle é uma integrante dos Adeptis. No passado, ela foi uma órfã que viveu no mesmo orfanato onde Xandria vivia.",艾莉西亚·博伊尔是 Adeptis 之一。过去她同样是一名孤儿，也曾住在和珊德莉雅相同的那所孤儿院里。
NANALETTER_TITLE,Carta de Nana,Nana's Letter,Carta da Nana,娜娜的信
NANALETTER_DESC,"Era una dulce niña, en un mundo de muerte y aflicción. Sus ojos carmesíes brillaban tiernamente como una flor, aunque su cabello parecía estar hecho de noche y de dolor.

Llevando aquella flor que nunca se marchita, la dulce niña hará que el corazón de su hermano se agite, pues será la luz blanca que dará el último adiós al alma que ya se quebranta.","She was a sweet girl, in a world of grief and pain.
Her crimson eyes shone softly, like a flower in the rain,
Though her hair seemed woven from the night and sorrow's reign.

Carrying that flower which never fades,
The sweet girl will stir her brother’s heart,
For it will be the white light that bids farewell,
To the soul that's torn apart.","Ela era uma garota doce, num mundo de dor e tristeza.
Os olhos carmesim dela brilhavam suavemente, como uma flor na chuva,
Embora seu cabelo parecesse tecido pelo reinado da noite e da tristeza.

Carregando aquela flor que nunca murcha,
A doce menina comoverá o coração de seu irmão,
Pois será a luz branca que dirá adeus,
À alma dilacerada.","她曾是个甜美的女孩，活在悲伤与痛苦的世界里。
她那绯红的眼眸柔和闪耀，如同雨中的花朵。
她的发丝仿佛由长夜与哀愁编织而成。

怀抱那朵永不凋零的花，
那个甜美的女孩将唤起她兄长的心，
因为那会是送别的白光，
照向那被撕裂的灵魂。"
ABOUTDIRIAN_TITLE,Cacique Dirián Razhes,Cacique Dirián Razhes,Cacique Dirián Razhes,酋长迪里安·拉杰斯
ABOUTDIRIAN_DESC,"Dirián Razhes es el Cacique del pueblo que habita los islotes en el mar de Niquira. 

Él tiene la responsabilidad de proteger un poder que se creía una leyenda que permite a un Alquimista, dominar otros elementos de la misma familia o período, en otras palabras, un elemento de la misma columna o fila correspondiente a la tabla periódica.

Por ejemplo, un Alquimista de Hierro podría controlar el Cobre o un elemento radioactivo como el Plutonio.

Un poder así es demasiado peligroso, teniendo en cuenta que Dirián se ha aliado con Johannes.
","Dirián Razhes is the Cacique of the people who inhabit the islets in the Niquira Sea. 

He has the responsibility to protect a power that was believed to be a legend that allows an Alchemist to dominate other elements of the same family or period. In other words, an element of the same column or row corresponding to the periodic table.

For example, an Iron Alchemist could control Copper or a radioactive element such as Plutonium.

Such a power is too dangerous, considering that Dirián has allied himself with Johannes.","Dirian Razhes é o Cacique do povo que habita as ilhotas do Mar Niquira. 

Ele tem a resposabilidade de proteger um poder que se acreditava ser uma lenda, permitindo que um Alquimista dominasse outros elementos da mesma família ou período, ou seja, um elemento da mesma coluna ou linha correspondente à tabela periódica.

Por exemplo, um Alquimista de Ferro poderia controlar o Cobre ou um elemento radioativo como o Plutônio.

Tal poder é muito perigoso, considerando que Dirian se aliou com Johannes.","迪里安·拉杰斯是居住在尼基拉海群岛上的部族酋长。

他肩负着守护一股曾被视作传说之力的职责。这股力量能让炼金术师支配与自身元素属于同一族、同一周期的其他元素。也就是说，能够操控元素周期表中同一列或同一行的元素。

例如，铁之炼金术师可以操控铜，或是钚这样的放射性元素。

考虑到迪里安已经与约翰内斯结盟，这种力量实在过于危险。"
ABOUTIXQUICCIRCUIT_TITLE,La bendición de Ixquic,The Ixquic blessing,A Bênção de Ixquic,伊克斯奎克的赐福
ABOUTIXQUICCIRCUIT_DESC,"El legendario poder que protegía Dirián Razhes resultó ser un circuito elemental. 

Johannes ha logrado adueñarse de un poder que permite a Alquimistas controlar otro elementos con la restricción de ser del mismo período o familia del elemento dominante.

Pero al ser un Circuito elemental, cabe la posibilidad de mejorarlo y eliminar esta restricción...

Al final, este circuito mejorado sería lo que Alquimistas llaman el [Opus Magnum.]","The legendary power that protected Dirián Razhes turned out to be an elemental circuit. 

Johannes has managed to take possession of a power that allows Alchemists to control other elements with the restriction of being of the same period or family of the dominant element.

But being an elemental circuit, it is possible to improve it and eliminate this restriction...

In the end, this improved circuit would be what Alchemists call the [Opus Magnum].","O poder lendário que protegia Dirian Razhes revelou-se um circuito elemental.

Johannes conseguiu tomar posse de um poder que permite aos Alquimistas controlar outros elementos com a restrição de serem do mesmo período ou família do elemento dominante.

Mas, sendo um circuito elemental, é possível aprimorá-lo e eleiminar essa restrição...

No fim, esse circuito aprimorado seria o que os Alquimistas chamam de [Opus Magnum.]","守护迪里安·拉杰斯的那股传说之力，结果被证实其实是一种元素回路。

约翰内斯已经设法夺取了这种力量，使炼金术师得以操控其他元素，但仍受限于那些元素必须与主导元素同属一个周期或同一家族。

但既然它本质上是元素回路，就有可能被进一步改良，从而消除这一限制……

而这种被改良后的回路，最终便会成为炼金术师口中的 [至高杰作]。"
EVALETTER_TITLE,Informe de Eva Brahm,Eva Brahm's Report,Relatório de Eva Brahm,伊娃·布拉姆的报告
