keys,es,en,pt_BR,zh_CN
EVALETTER_DESC,"Mi señor, tal como me lo ha ordenado estoy en Birstall, resguardando la moneda que bloquea el paso a los pisos superiores de la Abadía de Athos.

La otra moneda la dejé con los hermanos Cavendish, quienes han logrado sincronizar sus ondas de manipulación elemental. Juntos, ellos no dejarán que esa intrometida Alquimista pase más allá de la torre de reloj abandonada de Stralsund. Si algo falla, el Toziuha Ahalcaná estará al pendiente para realizar el pacto.

Y por último, con los documentos dejados por Sheal, hemos conseguido una versión más potente de la sangre de athos, los Ahuizotes que la consumen experimentan un mayor poder y agresividad, se encuentran protegiendo la Abadía, no dejaremos que esa Alquimista ni La Orden interfiera en sus planes divinos.

-- Eva Brahm.","My lord, as you commanded, I am in Birstall, guarding the coin that blocks access to the upper floors of Athos Abbey.

I left the other coin with the Cavendish brothers, who have managed to synchronize their elemental manipulation waves. Together, they will not let that meddlesome Alchemist to pass beyond the abandoned clock tower of Stralsund. If something goes wrong, the Toziuha Ahalcaná will be on hand to carry out the pact.

And finally, with the documents left by Sheal, we have obtained a more powerful version of the blood of Athos. The Ahuizotes who consume it experience greater power and aggression. They are protecting the Abbey. We will not let that Alchemist or the Order interfere with your divine plans.

-- Eva Brahm.","Meu Senhor, como me ordenastes, estou em Birstall, protegendo metade do amuleto que bloqueia a passagem para os andares superiores da Abadia de Athos.

A outra metade permanece sob a custódia dos Irmãos Cavendish, que conseguiram sincronizar suas ondas de manipulação. Juntos, não deixarão aquela Alquimista intrometida passar além da torre do relógio abandonada de Stralsund. Se algo der errado, Toziuha Ahalcaná estará à disposição para executar o pacto.

E, finalmente, com os documentos deixados por Sheal, obtivemos uma versão mais poderosa do sangue de Athos, os Ahuizotes que o consomem experimentam maior poder e agressividade. Eles estão protegendo a Abadia, não deixaremos aquela Alquimista nem A Ordem interferirem em seus planos divinos.

-- Eva Brahm.","吾主，如您所命，我如今身在比尔斯托尔，守卫着那枚阻挡外人进入阿托斯修道院上层的硬币。

另一枚硬币我已交给卡文迪许兄弟。他们已经能够同步各自的元素操控波动。两人联手，绝不会让那个多管闲事的炼金术师越过斯特拉尔松德废弃钟楼。若事情有变，托祖哈·阿哈尔卡纳将会出手完成契约。

最后，借由希尔留下的文献，我们得到了更为强大的阿托斯之血版本。服用它的 Ahuizotes 会变得更加强大，也更加狂暴。如今他们正在守护修道院。我们绝不会让那个炼金术师或教团干扰您神圣的计划。

——伊娃·布拉姆"
EVANEWS2_TITLE,Noticia sobre desaparición,News about disappearance,Notícias sobre desaparecimento,失踪新闻
EVANEWS2_DESC,La ciudad de Birstall se sume en misterio tras la desconcertante desaparición de la actriz de teatro Evangelina Graham. Tras el brutal ataque que sufrió hace una semana...,The city of Birstall is shrouded in mystery following the baffling disappearance of theater actress Evangelina Graham. After the brutal attack she suffered a week ago...,"A cidade de Birstall está envolvida em mistério, seguido pelo desconcertante desaparecimento da atriz de teatro Evangelina Graham. Após o ataque brutal que ela sofreu a uma semana atrás…",剧院女演员伊万杰琳娜·格雷厄姆离奇失踪，令比尔斯托尔全城陷入迷雾。一周前，她才刚遭受那场残忍袭击……
EVANEWS1_TITLE,Noticia [ataque a actriz],News [attack on actress],Notícias [atentado à atriz],新闻［女演员遇袭］
EVANEWS1_DESC,"La Gaceta Nocturna – Edición Especial

¡Tragedia en el Escenario! La Musa del teatro, Evangelina Graham, víctima de un brutal ataque.

Birstall se halla conmocionada por el brutal ataque a Evangelina, la estrella fugaz del Teatro de la Fortuna. Evangelina ascendió rápidamente, cautivando a miles con su deslumbrante belleza y talento. Se convirtió en la joya del entretenimiento, deseada por numerosos admiradores de todas las clases sociales. Sin embargo, su éxito atrajo una sombra: un insistente y acaudalado noble quien no aceptaba sus reiterados rechazos.

La tragedia ocurrió anoche, cuando, tras una función triunfal, Evangelina fue atacada al salir del teatro. Un chorro de ácido corrosivo impactó su rostro, causándole graves heridas. Los escenarios del Teatro de la Fortuna permanecen a oscuras, mientras el estado de salud de Evangelina, aún crítico, mantiene a todos en vilo...","The Night Gazette – Special Edition

Tragedy on Stage! Theater muse Evangelina Graham victim of brutal attack.

Birstall is in shock over the brutal attack on Evangelina, the shooting star of the Theater of Fortune. Evangelina rose quickly, captivating thousands with her dazzling beauty and talent. She became the jewel of entertainment, desired by numerous admirers from all walks of life. However, her success attracted a shadow: a persistent and wealthy nobleman who would not accept her repeated rejections.

The tragedy occurred last night when, after a triumphant performance, Evangelina was attacked as she left the theater. A stream of corrosive acid struck her face, causing serious injuries. The stages of the Theater of Fortune remain dark, while Evangelina's condition, still critical, keeps everyone on edge...","A Gazeta Noturna – Edição Especial

Tragédia no Palco! Musa Evangelina Graham é vítima de um ataque brutal.

Birstall está em choque com o ataque brutal a Evangelina, a estrela do Teatro da Fortuna. Evangelina ascendeu rapidamente, cativando milhares com sua beleza e talento deslumbrantes. Tornou-se a jóia do entretenimento, desejada por inúmeros admiradores de todas as esferas da vida. No entanto, seu sucesso atraiu uma sombra: um nobre persistente e rico que não aceitava suas repetidas rejeições.

A tragédia ocorreu ontem à noite quando, após uma apresentação triunfal, Evangelina foi atacada ao sair do teatro. Um jato de ácido corrosivo atingiu seu rosto, causando ferimentos graves. Os palcos do Teatro da Fortuna permanecem às escuras, enquanto o estado de Evangelina, ainda crítico, mantém todos em alerta...","夜间公报 特别版

舞台惨剧！剧院缪斯伊万杰琳娜·格雷厄姆惨遭残忍袭击。

比尔斯托尔因伊万杰琳娜遭受的残忍攻击而震惊不已。这位“命运剧院”的耀眼新星，曾凭借惊人的美貌与才华迅速崛起，迷倒了成千上万的观众。她成为娱乐界的明珠，吸引了无数来自各阶层的仰慕者。然而，她的成功也招来了一道阴影：一位执拗而富有的贵族，不愿接受她一次又一次的拒绝。

惨剧发生在昨夜。伊万杰琳娜在一次大获成功的演出后离开剧院时，遭到袭击。一股腐蚀性酸液泼向她的脸部，造成严重伤害。如今“命运剧院”的舞台已然熄灯，而伊万杰琳娜仍处于危险之中，牵动着所有人的神经……"
XOCHILTLETTER_TITLE,Carta de Xóchitl,Xóchitl's letter,Carta de Xóchitl,索奇特尔的信
XOCHILTLETTER_DESC,"Carta encontrada dentro de un contenedor ignífugo que dice lo siguiente:

En estos dos años como infiltrada en la secta de los Ahuizotes finalmente hice avances reuniendo información.

Su líder proclama que los guiará hacia el ""milagro"" de la resurrección gracias al [Opus Magnum].

Solo los Adeptis están al tanto sobre cómo crearán el Opus Magnum.

Sin embargo, se sabe que consta de cuatro etapas para su transmutación:

1-Rubedo, 2-Albedo, 3-Citrinitas, 4-Nigredo.

Se dice que la primera etapa, Rubedo, fue alcanzada gracias a cierto incidente ocurrido en la región de Transilvania.

La segunda etapa, Albedo, fue completada con la invasión de demonios en Grijayla.

En esta ciudad los Ahuizotes descubrieron un laboratorio secreto de un investigador especializado en óptica llamado Jean Neumann.

Desconozco de qué trata la 3ra y 4ta fase.

Mi último descubrimiento es sobre el lugar donde se oculta Johannes Trithemius.

Hay una puerta enorme en el lugar donde los Ahuizotes se reunen, una abadía antigua ubicada al norte, pasando por Eztilia. 

Esta puerta solo se abre cuando todos los Adeptis se reunen, colocando sus medallones en un orden específico.

Logré escabullirme y ver el orden en el que lo hacían: %s

Espero que esto logre con nuestra misión de erradicar a los Ahuizotes de una vez por todas.

-- Xóchitl Nahoa.","Letter found inside a fireproof container that reads as follows:

In these two years as an infiltrator in the sect of the Ahuizotes, I finally made progress gathering information.

Their leader proclaims that he will guide them to the ""miracle"" of resurrection thanks to the [Opus Magnum].

Only the Adeptis are aware of how they will create the Opus Magnum.

However, it's known that it consists of four stages for its transmutation:

1-Rubedo, 2-Albedo, 3- Citrinitas, 4-Nigredo.

The first stage, Rubedo, is said to have been achieved thanks to a certain incident in the Transylvania region.

The second stage, Albedo, was completed with the invasion of demons in Grijayla.

In this city, the Ahuizotes discovered the secret laboratory of a researcher specialized in optics named Jean Neumann.

I don't know what the 3rd and 4th phases are about.

My last discovery is about the place where Johannes Trithemius is hiding.

There is a huge door in the place where the Ahuizotes gather, an ancient abbey located to the north, passing through Eztilia. 

This door only opens when all the Adeptis gather, placing their medallions in a specific order.

I managed to sneak in and see the order in which they did it: %s.

I hope this accomplishes our mission to eradicate the Ahuizotes once and for all.

-- Xóchitl Nahoa.","Carta encontrada dentro de um contêiner a prova de fogo, que diz:

Nesses dois anos como um infiltrado na seita dos Ahuizotes, eu finalmente fiz progresso em coletar informação.

O líder deles proclama que os guiará ao “milagre” da ressurreição graças ao [Opus Magnum].

Apenas os Adeptis são cientes de como eles criarão o Opus Magnum.

Porém, é sabido que consiste nos quatro estágios de sua transmutação:

1-Rubedo, 2-Albedo, 3- Citrinitas, 4-Nigredo.

O primeiro estágio, Rubedo, é dito que foi alcançado graças a um certo evento na região da Transilvânia.

O segundo estágio, Albedo, foi completado com a invasão de demônios em Grijayla.

Nessa cidade, os Ahuizotes descobriram um laboratório secreto de um pesquisador especializado em ótica chamado Jean Neumann.

Eu não sei sobre o que se tratam das fases 3 e 4.

Minha última descoberta é sobre o local onde Johannes Trithemius está se escondendo.

Há uma porta enorme no local onde os Ahuizotes se reúnem, uma antiga abadia localizada ao norte, passando por Eztilia. 

Essa porta apenas abre quando todos os Adeptis se reúnem, colocando seus medalhões numa ordem específica.

Eu consegui me infiltrar e ver a ordem que eles colocaram: %s.

Eu espero que cumpra a nossa missão de erradicar os Ahuizotes de uma vez por todas.

-- Xóchitl Nahoa.","在一个防火容器中发现的信件，内容如下：

我潜入 Ahuizotes 教派的这两年里，终于在搜集情报上有所进展。

他们的首领宣称，自己将凭借 [至高杰作] 引领众人迈向复活的“奇迹”。

只有 Adeptis 知晓他们将如何完成至高杰作。

不过，已知它的嬗变共分为四个阶段：

1-赤化，2-白化，3-黄化，4-黑化。

据说第一阶段“赤化”，是因特兰西瓦尼亚地区发生的某起事件才得以达成。

第二阶段“白化”，则是在格里哈伊拉遭受恶魔入侵时完成的。

Ahuizotes 在这座城市里发现了一位名叫让·诺伊曼、专精光学的研究者所留下的秘密实验室。

至于第三和第四阶段究竟是什么，我还不清楚。

我最后查到的情报，是约翰内斯·特里特米乌斯藏身之处。

在 Ahuizotes 聚集之地，有一扇巨大的门。那是一座位于北方、途经埃兹提利亚后才能抵达的古老修道院。

唯有所有 Adeptis 全数到齐，并依照特定顺序放置各自的徽章，这扇门才会开启。

我设法潜入其中，亲眼看到他们摆放的顺序：%s。

希望这些情报能帮助我们一劳永逸地铲除 Ahuizotes。

——索奇特尔·纳瓦"
ABOUTWITCHATHOS_DESC,"Se cuenta que la Abadía de Athos tiene más de mil años desde que fue construida.

Los Ahuizotes se adueñaron de la abadía, pero ni siquiera ellos conocen todos los secretos que oculta esta edificación.

Según algunos registros historicos se cuenta que existió una Bruja que dio origen a lo que hoy conocemos como [Circuitos Elementales].

Esta bruja fue la que mandó a construir esta abadía. Y su altar se encuentra escondido en algún lugar, varias fuentes señalan que se encuentra ""al oeste de la habitación que gira"".

Desconozco donde podría estar ubicado ya que no he tenido tiempo de explorar la abadía, quizás esa pista signifique algo para ti.

Atentamente, ""D"".","It's said that the Athos Abbey is over a thousand years old since it was built.

The Ahuizotes took over the abbey, but even they don't know all the secrets hidden within this building.

According to some historical records, there was a witch who gave rise to what we now know as [Elemental Circuits].

This witch was the one who ordered the construction of this abbey. And her altar is hidden somewhere; several sources indicate that it is located “west of the room that spins.”

I don't know where it might be located since I haven't had time to explore the abbey, but perhaps that clue means something to you.

Sincerely, ""D.""","Dizem que a Abadia de Athos tem mais de mil anos desde que foi construída.

Os Ahuizotes tomaram conta da abadia, mas não conhecem todos os segredos escondidos dentro do edifício.

De acordo com registros históricos, havia uma bruxa que deu origem ao que hoje conhecemos como [Circuitos Elementais].

Esta bruxa foi quem ordenou a construção desta abadia. E seu altar está escondido em algum lugar; várias fontes indicam que está localizado “a oeste da sala que gira.”

Não sei onde está localizado, já que não tive tempo de explorar a abadia, mas talvez essa pista signifique algo para você.

Sinceramente, ""D.""","据说阿托斯修道院自建成以来，已屹立超过千年。

Ahuizotes 虽然占据了这座修道院，但即便是他们，也不知道这栋建筑中隐藏着的所有秘密。

根据某些历史记载，曾有一位魔女开创了我们今日所知的 [元素回路]。

也正是这位魔女下令建造了这座修道院。她的祭坛被藏在某处；多方资料都指出，它位于“旋转之室西侧”。

我不知道那究竟在什么地方，因为我没有足够时间探索整座修道院。但说不定，这条线索对你有意义。

此致，
“D”"
ABOUTWITCHATHOS_TITLE,La bruja escondida,The hidden witch,A bruxa escondida,隐匿的魔女
ABOUTTOZIUHANIGHT_TITLE,La noche de los Toziuha,The Toziuha night,A noite dos Toziuha,托祖哈之夜
ABOUTTOZIUHANIGHT_DESC,Se le conoce de esta manera al evento ocurrido durante la última semana de octubre. Es el momento cuando los demonios reciben un mayor poder debido a que las puertas del inframundo se abren.,This is the name given to the event that occurs during the last week of October. It is the moment when demons receive greater power because the gates of the underworld open.,Este é o nome dado ao evento que ocorreu na última semana de outubro. É o momento em que os demônios ganham mais poder porque os portões do submundo são abertos.,这是发生在十月最后一周的事件名称。届时冥界之门开启，恶魔会获得更强大的力量。
DIRIANLETTER_TITLE,Carta de Dirián Razhes,Dirián Razhes' letter,Carta de Dirián Razhes,迪里安·拉杰斯的信
DIRIANLETTER_DESC,"Xandria, sí estás leyendo esto, seguramente yo ya dejé este mundo terrenal.

Se siente raro escribir esto, es la primera vez que escribo una carta y debe ser de esta manera.

Me alié con Johannes porque sabía que él quería la bendición de Ixquic, ya sabes, ""mantén a tus amigos cerca y a tus enemigos más cerca"".

Cuando estuve en la abadía, mantuve contacto con una alquimista infiltrada que era nativa de nuestro pueblo. Intercambiamos información vital. Es una lástima lo que le pasó...

En fin, no fue el único alquimista con el que tuve contacto. Me encontré con alguien llamado Damián quien dice haberte conocido, me entregó un libro que habla sobre la construcción de la abadía de Athos.

Según lo que leí, al parecer existe una entrada secreta, algo que ni siquiera los Adeptis sabiamos.

Tengo una corazonada, de que Johannes nos ocultó esta información. Para quizás resguardar algo o alguien importante en su plan.

""Busca a la bruja escondida, arrodíllate frente a ella hasta que el gato negro aparezca, entonces será el momento cuando el guardián Aguila te deje pasar.""

No tengo idea de lo que eso significa, pero estaba escrito en el libro y parece importante.

Te deseo lo mejor y que nuesto pueblo... pero también el resto pueda ser salvado. La gente buena merece ver un nuevo amanecer.

Atentamente, Dirián Razhes.","Xandria, if you're reading this, I've probably already left this earthly world.

It feels strange to write this; it's the first time I've ever written a letter, and it has to be this way.

I allied myself with Johannes because I knew he wanted Ixquic's blessing. You know, “keep your friends close and your enemies closer.”

When I was at the abbey, I kept in touch with an infiltrated alchemist who was a native of our village. We exchanged vital information. It's a shame what happened to her...

Anyway, she wasn't the only alchemist I had contact with. I met someone named Damian who claims to have known you. He gave me a book about the construction of the Athos Abbey.

According to what I read, there seems to be a secret entrance, something that even we Adeptis didn't know about.

I have a hunch that Johannes hid this information from us. Perhaps to protect something or someone important to his plan.

“Find the hidden witch, kneel before her until the black cat appears, then it will be time for the guardian Eagle to let you pass.”

I have no idea what that means, but it was written in the book, and it seems important.

I wish you the best and hope that our people... but also the rest can be saved. Good people deserve to see a new dawn.

Sincerely, Dirián Razhes.","Xandria, se está lendo esta carta, provavelmente eu já deixei este mundo.

É tão estranho escrever isto; é a primeira vez na minha vida que escrevo uma carta, e tem que ser desta maneira.

Me aliei com Johannes porque eu sabia que ele queria a Bênção de Ixquic. Você sabe que “devemos manter nossos amigos próximos e seus inimigos mais próximos ainda.”

Quando eu estava na abadia, mantive contato com uma alquimista infiltrada, natural da nossa aldeia. Trocamos informações vitais. É uma pena o que aconteceu com ela...

De qualquer forma, ela não foi a única alquimista com quem tive contato. Conheci alguém chamado Damian, que afirma ter conhecido você. Ele me deu um livro sobre a construção da Abadia de Athos.

Pelo que li, parece haver uma entrada secreta, algo que nem nós, Adeptis, sabíamos.

Tenho um palpite de que Johannes escondeu essa informação de nós. Talvez para proteger algo ou alguém importante para seu plano. Algo que nem nós, Adeptis, sabíamos.

“Encontre a bruxa escondida, ajoelhe-se diante dela até que o gato preto apareça, então será a hora da águia guardiã deixá-lo passar.” 

Não tenho ideia do que isso significa, mas estava escrito no livro e parece importante.

Te desejo o melhor e espero que o nosso povo... e também o resto, possam ser salvos. Pessoas boas merecem ver um novo amanhecer.

Atenciosamente, Dirián Razhes.","珊德莉雅，如果你读到了这封信，那我大概已经离开这个尘世了。

以这种方式写下人生中的第一封信，感觉很奇怪。

我之所以与约翰内斯结盟，是因为我知道他想得到伊克斯奎克的赐福。你也知道，“把朋友放近些，把敌人放得更近些”。

我待在修道院时，一直与一位来自我们村子的潜伏炼金术师保持联络。我们交换了许多至关重要的情报。可惜她后来遭遇了那样的下场……

不过，她并不是我接触过的唯一炼金术师。我还遇见了一个名叫达米安的人，他声称自己认识你。他交给我一本关于阿托斯修道院建造过程的书。

根据书里的内容，这座修道院似乎存在一处秘密入口，连我们这些 Adeptis 之前都不知晓。

我怀疑约翰内斯故意向我们隐瞒了这条情报。也许是为了保护某件东西，或某个对其计划极为重要的人。

“找到那位隐匿的魔女，在她面前跪下，直到黑猫出现；届时，守护之鹰就会放你通行。”

我完全不知道这句话是什么意思，但它写在书里，而且看起来很重要。

我衷心祝愿你一切顺利，也希望我们的族人……乃至其他所有人，都还能得救。善良的人，理应见到新的黎明。

迪里安·拉杰斯 敬上"
UNLOCKHARDMODENOW,Desbloquear modo difícil,Unlock HARD mode,,解锁困难模式
UNLOCKHARDMODENOW_DESC,"Al momento de crear una partida, pulsa [Abajo->Arriba->Salto] mientras está seleccionado el tercer retrato de dificultad para jugar el modo difícil. Un reto mayor para aquellos valientes alquimistas.","When creating a game, press [Down->Up->Jump] while the third difficulty icon is selected to play in hard mode. A greater challenge for those brave alchemists.",,创建游戏时，在选中第三个难度图标的情况下按下 [下->上->跳跃]，即可游玩困难模式。为勇敢的炼金术师准备的更高挑战。
