keys,es,en,pt_BR,zh_CN
ENEMIES_NOTE_GRIJAYLA_ATTACK_DESC,"[Carta encontrada en Grijayla dirigida a los Ahuizotes].

Hermanos, nos han encomendado la importante misión de ayudar en la creación del [Opus Magnum].

Sigan las ordenes de la Adeptis primera y dirijanse a la parte Noroeste de la ciudad en busca del [Prisma de dispersión inversa].

Reciban este mapa para no dejar ningún lugar sin revisar.

Que Athos esté con ustedes.","[Letter found in Grijayla addressed to the Ahuizotes].

Brothers, we have been entrusted with the important mission of assisting in the creation of the [Opus Magnum].

Follow the orders of the Adeptis primera and head to the northwest part of the city in search of the [Reverse Dispersion Prism].

Receive this map to leave no place unchecked.

Athos be with you.","[Carta encontrada em Grijayla, endereçada aos Ahuizotes].

Irmãos, nos foi confiada a importante missão de auxiliar na criação do [Opus Magnum].

Siga as ordens de Adeptis primera e sigam à parte noroeste da cidade na procura do [Prisma de Dispersão Reverso]

Receba esse mapa e não deixem nenhum local checado.

Athos esteja com vocês.","[在格里哈伊拉发现、写给 Ahuizotes 的信件]。

兄弟们，我们已被赋予协助完成 [至高杰作] 的重要使命。

遵照 Adeptis primera 的命令，前往城市西北区域，寻找 [逆向色散棱镜]。

收下这张地图，务必不要漏掉任何地方。

愿阿托斯与你同在。"
ENEMIES_NOTE_GRIJAYLA_ATTACK_TITLE,Ataque en Grijayla,Attack in Grijayla,Ataque em Grijayla,格里哈伊拉袭击行动
ANON_LETTER_I_TITLE,Carta Anónima I,Anonymous letter I,Carta anônima 1,匿名信 I
ANON_LETTER_I_DESC,"[Carta encontrada en Grijayla, autor desconocido]

Tengo que decir que estoy muy agradecido de que nuestro Señor haya decidido iluminar mi camino y conducirme hacia la cura que tanto necesitaba. ¡Me siento mucho mejor ahora!

Los Ahuizotes me han suministrado la sangre bendita de Athos. Me ha curado por completo. Algo que la ciencia de los mortales no pudo lograr. Ahora entiendo el verdadero poder del que [La Orden] se ha encargado de ocultar.

No puedo explicar con palabras la felicidad que siento al haber encontrado la salvación en Athos. Ahora sé que mi futuro está en seguir al señor Trithemius, portador de su voluntad.

Me iré de este lugar a predicar la verdad absoluta.

Si alguien más se encuentra en una situación similar a la mía, les sugiero que abran sus corazones y se encomienden a la divina gracia de Athos.","[Letter found in Grijayla, author unknown].

I have to say that I'm very grateful that our Lord has decided to enlighten my path and lead me to the cure I needed so much. I feel much better now!

The Ahuizotes have supplied me with the blessed blood of Athos. It has healed me completely. Something that mortal science could not achieve. Now I understand the true power that [The Order] has taken care to hide.

I cannot explain in words the happiness I feel at having found salvation in Athos. Now I know that my future lies in following Lord Trithemius, the bearer of his will.

I will leave this place to preach the absolute truth.

If anyone else finds themselves in a similar situation to mine, I suggest that they open their hearts and entrust themselves to the divine grace of Athos.","[Carta encontrada em Grijayla, autor desconhecido].

Tenho que dizer que estou muito agradecido que o nosso Senhor tenha decidido iluminar meu caminho e me levar a cura que eu precisava tanto. Me sinto muito melhor agora!

Os Ahuizotes tem me fornecido com o sangue abençoado de Athos. Isso me curou completamente. Algo que a ciência dos homens não pôde alcançar. Agora eu entendo o verdadeiro poder que [A Ordem] tem se encarregado de esconder…

Eu não consigo explicar em palavras a felicidade que sinto ao encontrar a salvação em Athos. Agora eu sei que meu futuro está em seguir o Senhor Trithemius, o portador de Sua vontade.

Eu deixarei este lugar para pregar a verdade absoluta.

Se encontrar a si mesmos numa situação similar qua a minha, eu sugiro que abram seus corações e confiem a si mesmos a divina graça de Athos.","[在格里哈伊拉发现的信件，作者不详]。

我必须说，我由衷感激我们的主决定点亮我的道路，并引领我找到我一直苦苦寻求的解药。我现在感觉好多了！

Ahuizotes 为我提供了受阿托斯祝福的鲜血。它彻底治好了我。这是凡人的科学根本无法做到的事。如今我终于明白，[教团] 一直竭力隐藏的真正力量究竟是什么。

我无法用言语形容自己在阿托斯之中寻得救赎的喜悦。如今我知道，我的未来就在于追随特里特米乌斯大人，追随那位承载阿托斯意志的人。

我要离开这里，去宣扬这绝对的真理。

如果还有人遭遇了与我相似的处境，我建议他们敞开心扉，将自己托付给阿托斯的神圣恩典。"
ABOUT_VOLCAN_GAS_TITLE,Gases tóxicos en volcán,Toxic gas in volcano,Gás tóxico no vulcão,火山中的毒气
ABOUT_VOLCAN_GAS_DESC,"Es nuestra primera expedición al volcán ubicado en una de las islas de Tahuatepet. El aire se combina con el dióxido de azufre, un gas infernal cuyos vapores podrían debilitarnos lo suficiente como para que los goblins, astutos demonios, aprovechen la oportunidad de despojarnos de nuestras pertenencias y de nuestras vidas.

Debemos permanecer atentos al ennegrecimiento de la [Plata] que llevamos, ya que nos indicará aquellos lugares donde ese gas es abundante.","It's our first expedition to the volcano located on one of the islands of Tahuatepet. The air combines with sulfur dioxide, an infernal gas whose vapors could weaken us enough for the goblins, cunning demons, to take advantage of the opportunity to strip us of our belongings and our lives.

We must remain attentive to the blackening of the [Silver] we carry, as it will indicate those places where this gas is abundant.","Esta é a nossa primeira expedição ao vulcão localizado em uma das ilhas de Tahuatepet. O ar combina com dióxido de enxofre, um gás infernal com vapores que podem nos enfraquecer o bastante para goblins, demônios ardilosos, de aproveitar a oportunidade de roubar nossas coisas e nossas vidas. 


Nós devemos nos manter atentos ao escurecimento da [Prata] que carregamos, assim indicará os locais onde o gás é abundante.","这是我们首次前往塔瓦特佩特某座岛上的火山进行探索。空气与二氧化硫混合，形成一种宛如地狱般的毒气；它的蒸汽足以削弱我们，让那些狡猾的恶魔哥布林趁机夺走我们的财物与性命。

我们必须时刻留意随身携带的 [银] 是否发黑，因为那会提示这种气体浓度较高的地点。"
ALCHEMIST_DESC,"Son aquellas personas capaces de controlar el movimiento atómico de un elemento químico en específico, utilizando el flujo de maná en sus cuerpos.","They are those people capable of controlling the atomic movement of a specific chemical element, using the flow of mana in their bodies.","São pessoas capazes de controlar o movimento atômico de um elemento químico específico, usando o fluxo de mana em seus corpos.",指那些能够借助体内法力流动，控制某一种特定化学元素原子运动的人。
ALCHEMIST_TITLE,Alquimista,Alchemist,Alquimista.,炼金术师
DEMON_TITLE,Demonios,Demons,Demônios,恶魔
DEMON_DESC,"Para describir a cualquier monstruo, se les llama ""Demonios"". Son criaturas peligrosas, sedientas de sangre. Atacan sin piedad y con poco razonamiento a cualquiera que se les cruce.","To describe any monster, they are called ""Demons"". They are dangerous, bloodthirsty creatures. They attack mercilessly and with little reasoning to anyone who crosses them.","Ao descrever qualquer monstro, eles são chamados “Demônios”. São criaturas perigosas e sedentas por sangue. Atacam de forma irracional e sem piedade a qualquer um que cruzam seu caminho. ",凡是怪物，一般统称为“恶魔”。它们危险而嗜血，几乎不讲理性，会毫不留情地攻击一切挡在面前的人。
TOZIUHA_TITLE,,Toziuha,Toziuha,托祖哈
TOZIUHA_DESC,"Se denomina ""Toziuha"" a demonios mayores, seres que cuentan con inteligencia superior al de una persona promedio. 

Sus poderes sobrepasan la comprensión humana, llegando sobrepasar sus límites en la última noche de octubre. Esto es lo que estiman los estudiosos sobre el tema.

Afortunadamente son criaturas poco frecuentes de encontrar y a pesar de su gran poder, no pueden atacar o causar daños. Por alguna razón desconocida, es como si no ""existieran"" en nuestro mundo.

Se conoce que los Toziuha buscan personas con las que hacen un ""pacto"", a cambio de una fracción de su poder, la persona ofrece su ""alma"" como medio de intercambio. No se conoce con qué fin los Toziuha realizan pactos.","They are called ""Toziuha"" [toh-see-OO-ah] to greater demons, beings that have intelligence superior to that of an average person. 

Their powers surpass human comprehension, surpassing their limits on the last night of October. This is what is estimated by scholars on the subject.

Fortunately, they are rare creatures to encounter and, despite their great power, they cannot attack or cause harm. For some unknown reason, it is as if they do not ""exist"" in our world.

The Toziuha are known to seek out people with whom they make a ""pact"", in exchange for a fraction of their power, the person offers their ""soul"" as a means of exchange. It is not known for what purpose the Toziuha make pacts.","Eles chamam de ""Toziuha"" [toh-see-OO-ah] os grande demônios, seres com uma inteligência superior do que uma pessoa comum. 

Os poderes deles superam a compreensão humana, superando seus limites na última noite de Outubro.. É o que é deduzido pelos estudiosos na área.

Felizmente, são criaturas raras de encontrar e, apesar de seu grande poder, não atacam ou causam algum mal. Por algum motivo desconhecido, é como se eles não “existissem” no nosso mundo.

Os Toziuha são conhecidos por procurarem pessoas com que desejam fazer um “pacto”, em troca de uma fração do poder deles, a pessoa oferece sua “alma”. Não é conhecido o propósito dos pactos dos Toziuha.","“托祖哈”[toh-see-OO-ah] 这一称呼，指的是高等恶魔，也就是智慧远超常人的存在。

根据相关学者的推测，它们的力量超越人类理解，并会在十月的最后一夜突破极限。

幸运的是，这类生物十分罕见；尽管力量强大，它们却无法主动攻击或造成伤害。不知出于何种原因，它们仿佛并“不存在”于我们的世界。

众所周知，托祖哈会寻找对象与之订立“契约”。作为交换，它们赐予对方一部分力量，而人则以自己的“灵魂”作为代价。至于托祖哈缔结契约的目的为何，至今仍无人知晓。"
AHUIZOTE_TITLE,,Ahuizote,Ahuizote,Ahuizote
AHUIZOTE_DESC,"Los ""Ahuizotes"" son un grupo religioso extremista, liderado por Johannes Trithemius, un hombre cuyo pasado se desconoce. Sus integrantes llevan máscaras y ropas negras para representar sus ""pecados"".

Sus creencias se basan en la existencia de una persona llamada ""Athos"", que trajo sabiduría y paz a un antiguo reino sumido en la guerra; siendo denominado como el verdadero padre de la alquimia.

Se dice que Athos fue acusado de herejía y condenado a muerte, traicionado por su mejor amigo, ""Hermes Trimegisto"". Los Ahuizotes claman que llegará un día en el que ellos lograrán el ""milagro"" de la resurrección y traer a Athos de nuevo a la vida.

Sin embargo, no se han encontrado evidencias de la existencia de esta persona llamada Athos.","The ""Ahuizotes"" [ah-wee-ZOH-teh] are an extremist religious group, led by Johannes Trithemius, a man whose past is unknown. Its members wear masks and black clothes to represent their ""sins"".

Their beliefs are based on the existence of a person called ""Athos"", who brought wisdom and peace to an ancient kingdom mired in war; being called the true father of alchemy.

It is said that Athos was accused of heresy and condemned to death, betrayed by his best friend, ""Hermes Trimegistus"". The Ahuizotes claim that a day will come when they will achieve the miracle of resurrection and bring Athos back to life.

However, no evidence of the existence of this person named Athos has been found.","""Ahuizotes"" [ah-wee-ZOH-teh] é um grupo extremista religioso, liderado po Johannes Trithemius, um homem com o passado desconhecido. Seus membros usam máscaras e roupas pretas para representar seus ""pecados"".

Suas crenças são baseados na existência de um ente chamado ""Athos"", que trouxe sabedoria e paz a um reino antigo enterrado na guerra; Sendo chamado o verdadeiro pai da alquimia.

É dito que Athos foi acusado de heresia e condenado a morte, traído pelo melhor amigo, ""Hermes Trimegistus"". Os Ahuizotes clamam que o dia chegará quando eles alcançarão o milagre da ressureição e trazer Athos de volta a vida.

Porém, não há evidência encontrada da existência dessa pessoa chamada Athos.","“Ahuizotes”[ah-wee-ZOH-teh] 是一个极端宗教团体，由约翰内斯·特里特米乌斯领导；此人的过去无人知晓。其成员佩戴面具、身着黑衣，以象征自身的“罪”。

他们的信仰核心，是一位名叫“阿托斯”的人物。传说他曾为一个深陷战乱的古王国带来智慧与和平，因此被称为真正的炼金术之父。

据说阿托斯因异端之名被判处死刑，而出卖他的人，正是他最好的朋友“赫尔墨斯·特里墨吉斯托斯”。Ahuizotes 宣称，总有一天他们会实现复活的奇迹，让阿托斯重返人世。

然而，至今仍未找到任何能证明这位名为阿托斯的人真实存在的证据。"
ADEPTIS_TITLE,,Adeptis,Adeptis,Adeptis
ADEPTIS_DESC,"De entre los Ahuizotes, existe un grupo selecto de personas que ademas de ser miembros de la secta, también son Alquimistas. Operan bajo las órdenes directas de Johannes.

El único adeptis del que se tiene registro, es Eva Brahm. Una mujer que se dice fue la primera Adeptis, además de posiblemente tener algún tipo de relación cercana con Johannes.","Among the Ahuizotes, there is a select group of people who, besides being members of the sect, are also Alchemists. They operate under the direct orders of Johannes.

The only adeptis of whom details are known is Eva Brahm. A woman who is said to be the first Adeptis, as well as possibly having some kind of close relationship with Johannes.","Entre os Ahuizotes, há um seleto grupo que, apesar de serem memebros da seita, são Alquimistas. Eles operam sob as ordens diretas de Johannes.

A única adeptis cujo os detalhes são conhecidos é sobre Eva Brahm. Uma mulher que é conhecida como a primeira Adeptis, e possivelmente tendo alguma relação próxima com Johannes.","在 Adeptis 之中，有一群被特别挑选出来的人；他们不仅是教派成员，同时也是炼金术师。他们直接听命于约翰内斯。

目前唯一有较明确情报的 Adeptis 是伊娃·布拉姆。据说她是第一位 Adeptis，并且很可能与约翰内斯之间存在某种亲密关系。"
RACHEL_TITLE,,Rachel Lavoisier,Rachel Lavosier,瑞秋·拉瓦锡
RACHEL_DESC,"Alquimista de Cobre. Una mujer de carácter tranquilo y amable. Actualmente está retirada, fue compañera de la actual directora de La Orden.

Una de sus últimas misiones involucró un orfanato que estaba siendo controlado en secreto por los Ahuizotes. Ahí conoció a una niña llamada Xandria.

Rachel adoptó a la niña y viendo el potencial como Alquimista le enseñó a pelear.","Copper Alchemist. A woman of calm and kind character. Currently retired, she was a partner of the current director of The Order.

One of her last missions involved an orphanage that was being secretly controlled by the Ahuizotes. There she met a little girl named Xandria.

Rachel adopted the girl and, seeing potential as an Alchemist, taught her how to fight.","Alquimista de Cobre. Uma mulher de caráter calmo e gentil. Atualmente aposentada, ela foi companheira da atual diretora da Ordem.

Uma das últimas missões dela envolveu um orfanato que estava controlado secretamente pelos Ahuizotes. Nesse local, ela encontrou uma criança chamada Xandria.

Rachel adotou a criança e vendo o potencial de ser uma Alquimista e a ensinando como lutar.","铜之炼金术师。性格沉静而温和的女性。如今已退休，曾是现任教团分部负责人的搭档。

她最后几次任务中的一次，牵涉到一所被 Ahuizotes 暗中控制的孤儿院。也正是在那里，她遇见了一个名叫珊德莉雅的小女孩。

瑞秋收养了这个孩子，并在看出她具备炼金术师资质后，亲自教她战斗。"
ALESSA_TITLE,,Alessa Bollstad,Alessa Bollstad,娅蕾莎·博斯塔德
ALESSA_DESC,"Es la directora de La Orden en Amerithia. Detrás de esa dulce sonrisa, se oculta una temible mujer. Se desconoce cuál es el elemento que Alessa domina, ya que quienes se han enfrentado a ella, no han vivido para contarlo.","She is the director of The Order in Amerithia. Behind that sweet smile hides a fearsome woman. The element that Alessa masters is unknown, as those who have faced her have not lived to tell the tale.","Ela é a diretora da Ordem em Amerithia. Por detrás do doce sorriso, esconde uma mulher assustadora. O elemento que Alessa domina é desconhecido, da mesma forma daqueles que a enfrentaram não viveram para contar a história.",她是阿美瑞西亚教团的负责人。那抹甜美的笑容背后，藏着的是一个令人畏惧的女人。娅蕾莎所掌握的元素至今无人知晓，因为凡是与她交手的人，都没能活着讲出经过。
THEORDER_TITLE,La Orden,The Order,A Ordem,教团
THEORDER_DESC,"Una antigua organización de Alquimistas fundada por Hermes Trimegisto, cuyo objetivo es el de proteger a las personas de los Demonios o cualquier amenaza que atente a la paz.

A pesar de contar con sedes en diferentes países, cada una es independiente y trabaja de formas distintas. Son raras las ocasiones en la que una sede solicita refuerzos o reuniones con otras sedes.","An ancient organization of Alchemists founded by Hermes Trimegistus, whose objective is to protect people from Demons or any threat to peace.

Despite having headquarters in different countries, each one is independent and works in different ways. It is rare that one branch requests reinforcements or meetings with other branches.","Uma antiga organização de Alquimistas fundada por Hermes Trimegistus, cujo o objetivo é proteger a humanidade dos Demônios ou qualquer ameaça a paz.

Apesar de ter sedes em diferentes países, cada um é independente e funciona de diferentes formas. É raro que uma filial solicitar reforços ou reuniões com outras filiais.","由赫尔墨斯·特里墨吉斯托斯创建的古老炼金术师组织，其宗旨是保护人们免受恶魔或任何威胁和平之物的侵害。

尽管它在不同国家都设有据点，但各处分部彼此独立，运作方式也不尽相同。某个分部向其他分部请求增援或召开会面，是极为少见的事。"
MARGARET_TITLE,,Margaret Curie,Margaret Curie,玛格丽特·居里
MARGARET_DESC,"Directora de la división de investigación de La Orden en Amerithia. Es una persona de gran inteligencia que ha hecho aportes importantes con artefactos que ayudan a Alquimistas en su lucha contra demonios.

Se encuentra generalmente en el laboratorio de alquimia, aunque rara vez sale en busca de materiales o muestras para sus investigaciones.","Director of the research division of The Order in Amerithia. She is a person of great intelligence who has made important contributions with artifacts that help Alchemists in their fight against demons.

She is usually in the alchemy laboratory, although she rarely goes out in search of materials or samples for her research.","Diretora da divisão de pesquisas da Ordem em Amerithia. Ela é uma pessoa de grande inteligência que fez importantes contribuições com artefatos que ajudam Alquimistas na luta contra os demônios.

Ela normalmente está no laboratório de alquimia, apesar de qu ela raramente sai à procura de materiais ou amostras para as suas pesquisas.","阿美瑞西亚教团研究部门的负责人。她是一位极其聪慧的人物，曾通过多种器具与装置，为炼金术师对抗恶魔的战斗作出重要贡献。

她通常待在炼金实验室里，不过偶尔也会亲自外出，寻找研究所需的素材或样本。"
GABRIEL_TITLE,,Gabriel Eclair,Gabriel Eclair,加布里埃尔·埃克莱尔
GABRIEL_DESC,"Trabaja en una tienda de Amerithia. Originario de la ciudad de Grijayla tuvo que mudarse debido a una invasión de demonios en Grijayla, durante el incidente su hija llamada Aura fue raptada por los Ahuizotes.","He works in a store in Amerithia. Originally from the city of Grijayla, he had to move due to a demon invasion in Grijayla during the incident where his daughter, named Aura, was kidnapped by the Ahuizotes.","Ele trabalha numa loja em Amerithia. Originalmente da cidade de Grijayla ele teve que se mudar por conta da invasão demoníaca em Grijayla, durante o incidente, sua filha chamada Aura foi raptada pelos Ahuizotes.",他在阿美瑞西亚的一家商店工作，原本来自格里哈伊拉。由于那次恶魔入侵格里哈伊拉、女儿奥拉又被 Ahuizotes 掳走，他不得不离开故乡搬迁至此。
ABOUT_STRALSUND_TITLE,Stralsund y Cavendish,Stralsund & Cavendish,Stralsund & Cavendish,斯特拉尔松德与卡文迪许
ABOUT_STRALSUND_DESC,"Stralsund fue una ciudad próspera gobernada por el aristócrata Henry Cavendish.

La ciudad fue cuna de la revolución industrial y contaba con diversas instituciones de investigación Alquímica. 

Grandes genios de la alquimia como Geber estudiaron en la academia de Stralsund.

Sin embargo, Cavendish se convirtió en miembro de los Ahuizotes. Se dice que su fortuna fue a parar a manos de Johannes Trithemius para financiar a la secta.

Al descubrirse este hecho, Cavendish fue setenciado con orden de captura, los Alquimistas de la Orden lo encontraron... pero él ya estaba muerto, su causa de muerte: envenenamiento por Arsénico. No obstante no se pudo determinar si fue un suicido o no...","Stralsund was a prosperous city governed by the aristocrat Henry Cavendish.

The city was the cradle of the industrial revolution and had several alchemical research institutions. 

Great alchemical geniuses, such as Geber, studied at the Stralsund academy.

However, Cavendish became a member of the Ahuizotes. It is said that his fortune went to Johannes Trithemius to finance the sect.

When this fact was discovered, Cavendish was sentenced with a warrant for his arrest. The Alchemists of the Order found him... but he was already dead, his cause of death: poisoning by arsenic. However, it could not be determined whether it was a suicide or not...","Stralsund foi uma próspera cidade governada pelo aristocrata Henry Cavendish.

A cidade foi o berço da revolução industrial e havia muitas instituições de pesquisa alquímica. 

Grandes gênios como Geber estudaram na Academia Stralsund.

Porém, Cavendish se tornou um membro dos Ahuizotes. É conhecido que sua fortuna foi para Johannes Trithemius para financiar a seita.

Quando o fato foi descoberto, Cavendish foi sentenciado com um mandado de prisão, os Alquimistas da Ordem o encontraram... mas ele já estava morto. A causa da morte foi envenenamento por arsênico. Porém, não pode ser determinado se foi suicídio ou não...","斯特拉尔松德曾是一座由贵族亨利·卡文迪许统治的繁荣城市。

这座城市是工业革命的摇篮，同时拥有多所炼金研究机构。

包括盖贝尔在内的许多伟大炼金天才，都曾在斯特拉尔松德学院求学。

然而，卡文迪许后来加入了 Ahuizotes。据说他的财富也流入了约翰内斯·特里特米乌斯之手，用以资助这个教派。

此事曝光后，卡文迪许遭到通缉并被判逮捕。教团的炼金术师找到他时……他已经死了，死因是砒霜中毒。至于那是否属于自杀，则始终未能查明……"
CAVENDISH_BROTHERS_TITLE,Hermanos Cavendish,Cavendish Brothers,Irmãos Cavendish,卡文迪许兄弟
CAVENDISH_BROTHERS_DESC,"Joseph y Annette Cavendish, hermanos. Hijos de Henry Cavendish.

Por alguna razón ahora son Adeptis de los Ahuizotes.

La hermana mayor, Annette, parece poseer un poder mayor al de su hermano, aunque se comporta a la defensiva, tarde o temprano ella se pondrá en acción.","Joseph and Annette Cavendish, siblings. Children of Henry Cavendish.

For some reason, they are now Adeptis of the Ahuizotes.

The older sister, Annette, seems to possess greater power than her brother, although she behaves defensively. Sooner or later, she will take action.","Joseph e Annette Cavendish, irmãos. Filhos de Henry Cavendish.

Por alguma razão, eles são agora Adeptis dos Ahuizotes.

A irmã mais velha, Annette, aparenta possuir grande poder do que seu irmão, apesar dela agir de forma defensiva, cedo ou tarde ela agirá.","约瑟夫与安妮特·卡文迪许，两人是兄妹，也是亨利·卡文迪许的子女。

不知为何，他们如今都成了 Ahuizotes 的 Adeptis。

身为姐姐的安妮特，似乎拥有比弟弟更强的力量，不过她行事更偏防守。迟早有一天，她会主动出手。"
AURA_TITLE,,Aura Eclair,Aura Eclair,奥拉·埃克莱尔
